"Dia";"Asignatura";"Tipo";"HoraInicio";"HoraFinal";"Aula";"Comentarios";"Grupo";"Semestre";"Titulacion"
"Lunes";"Análisis de Productos por Elementos Finitos";"Laboratorio";"14:30";"15:30";"";NA;"56AF";2;"56AF"
"Lunes";"Análisis de Productos por Elementos Finitos";"Teoría y Problemas";"15:30";"17:30";"A08";NA;"56AF";2;"56AF"
"Lunes";"Diseño del Montaje en Fabricación Industrial";"Teoría y Problemas";"17:30";"20:30";"A32";NA;"56AF";2;"56AF"
"Miércoles";"Seminarios de Desarrollo Profesional";"Teoría y Problemas";"15:30";"17:30";"A07";NA;"56AF";2;"56AF"
"Miércoles";"Certificación y Calificación de Productos";"Teoría y Problemas";"18:00";"20:30";"A08";NA;"56AF";2;"56AF"
"Jueves";"Selección y Diseño de Materiales";"Teoría y Problemas";"15:30";"17:30";"A08";NA;"56AF";2;"56AF"
"Jueves";"Mini Proyectos";"Teoría y Problemas";"17:30";"19:30";"A08";NA;"56AF";2;"56AF"
